word,Meaning 1,Meaning 2,Meaning 3,Meaning 4
nervous,Easily agitated or alarmed or tending to be anxious or highly strung,Anxious or apprehensive,(of a feeling or reaction) Resulting from anxiety or anticipation,Relating to or affecting the nerves
neurotic,"Suffering from, caused by, or relating to neurosis","Abnormally sensitive, obsessive, or tense and anxious",A neurotic person
non-conformist
nymphomaniac
obedient,Complying or willing to comply with orders or requests or submissive to another's will
objective,(of a person or their judgment) Not influenced by personal feelings or opinions in considering and representing facts,Not dependent on the mind for existence or actual,"Of, relating to, or denoting a case of nouns and pronouns used as the object of a transitive verb or a preposition",A thing aimed at or sought or a goal,The objective case,The lens in a telescope or microscope nearest to the object observed
observant,Quick to notice things,"Adhering strictly to the rules of a particular religion, esp. Judaism",A member of a branch of the Franciscan order that followed a strict rule
obsessive,Of the nature of an obsession,Affected by an obsession,A person who is affected by an obsession
obstinate,"Stubbornly refusing to change one's opinion or chosen course of action, despite attempts to persuade one to do so",(of an unwelcome phenomenon or situation) Very difficult to change or overcome
offensive,"Causing someone to feel deeply hurt, upset, or angry",(of a sight or smell) Disgusting or repulsive,Actively aggressive or attacking,(of a weapon) Meant for use in attack,(in a game) Of or relating to the team or player who is seeking to score,An attacking military campaign,"An organized and forceful campaign to achieve something, typically a political or social end"
open,"Allowing access, passage, or a view through an empty space or not closed or blocked up",(of a container) Not fastened or sealed or in a position or with the lid or other covering in a position allowing access to the inside part or the contents,(of a garment or its fasteners) Not buttoned or fastened,(of the mouth or eyes) With lips or lids parted,Free from obstructions,(of a car or house) Unlocked,(of a vowel) Produced with a relatively wide opening of the mouth and the tongue kept low,(of a syllable) Ending in a vowel,(of the bowels) Not constipated,(of a game or style of play) Characterized by action that is spread out over the field,Exposed to the air or to view or not covered,(of an area of land) Not covered with buildings or trees,Having spaces or gaps between elements,(of a fabric) Loosely knitted or woven,(of a team member in a game) Unguarded and therefore able to receive a pass,(of a goal or other object of attack in a game) Unprotected or vulnerable,(of a boat) Without a deck,Likely to suffer from or be affected by or vulnerable or subject to,"(of a town or city) Officially declared to be undefended, and so immune under international law from bombardment",With the outer edges or sides drawn away from each other or unfolded,"(of a book or file) With the covers parted or the contents in view, allowing it to be read",(of a hand) Not clenched into a fist,Damaged or injured by a deep cut in the surface,"(of a store, place of entertainment, etc.) Officially admitting customers or visitors or available for business",(of a bank account) Available for transactions,(of a telephone line) Ready to take calls,"(of a choice, offer, or opportunity) Still available or such that people can take advantage of it",(of a person) Frank and communicative or not given to deception or concealment,Not concealed or manifest,(of conflict) Fully developed and unconcealed,"Involving no concealment, restraint, or deception or welcoming discussion, criticism, and inquiry","(of a question, case, or decision) Not finally settled or still admitting of debate",(of the mind) Accessible to new ideas or unprejudiced,Receptive to,Admitting of or making possible,Freely available or accessible or offered without restriction,With no restrictions on those allowed to attend or participate,(of an award or the competition for it) Unrestricted as to who may qualify to compete,(of a ticket) Not restricted as to day of travel,(of a string) Allowed to vibrate along its whole length,(of a pipe) Unstopped at each end,(of a note) Sounded from an open string or pipe,(of an electrical circuit) Having a break in the conducting path,(of a set) Not containing any of its limit points,Move or adjust (a door or window) so as to leave a space allowing access and view,(of a door or window) Be moved or adjusted to leave a space allowing access and view,"Undo or remove the lid, cover, or fastener of (a container) to get access to the contents",Remove the covers or wrapping from,Part the lips or lids of (a mouth or eye),(of the mouth or eyes) Have the lips or lids parted in this way,(of a wound) Lose or lack its protective covering,Improve or make possible access to or passage through,Cause evacuation of (the bowels),"(of a room, door, or window) Give access to",(of a panorama) Come into view or spread out before someone,Achieve a clear view of (a place) by sailing past a headland or other obstruction,Spread out or unfold,Be unfolded or spread out to the full extent,Increase the spaces or gaps between elements of (something),Part the covers or display the contents of (a book or file) to read it,Become wider or more spacious,Allow public access to,Make available,Make more widely known or reveal,Become more communicative or confiding,Make (one's mind or heart) more receptive or sympathetic,Make someone vulnerable to,"Establish (a new business, movement, or enterprise)","(of an enterprise, esp. a commercial one) Be established","(of a store, place of entertainment, etc.) Be officially ready to receive customers or visitors or become ready for business",Take the action required to make ready for use,(of a meeting or a sporting or artistic event) Formally begin,(of a piece of writing or music) Begin,(of a process) Start to develop,"Officially or ceremonially declare (a building, road, etc.) to be completed and ready for use",(of a counsel in a court of law) Make a preliminary statement in (a case) before calling witnesses,Make (the first bid) in the auction,Break the conducting path of (an electrical circuit),(of an electrical circuit or device) Suffer a break in its conducting path,A championship or competition with no restrictions on who may qualify to compete,An accidental break in the conducting path for an electrical current
opinionated,Conceitedly assertive and dogmatic in one's opinions
opportunistic,Exploiting chances offered by immediate circumstances without reference to a general plan or moral principle,(of a plant or animal) Able to spread quickly in a previously unexploited habitat,"(of a microorganism or an infection caused by it) Rarely affecting patients except in unusual circumstances, typically when the immune system is depressed"
optimistic,Hopeful and confident about the future,Involving an overestimate
orderliness
organizational ability
original,Used or produced at the creation or earliest stage of something,Present or existing at the beginning of a series or process or first,Created directly and personally by a particular artist or not a copy or imitation,Not dependent on other people's ideas or inventive and unusual,Something serving as a model or basis for imitations or copies,The form or language in which something was first produced or created,A person or place on which a character or location in a literary work is based,"A song, picture, etc., produced by a performer or artist personally",A book or recording that has not been previously made available in a different form,A garment made to order from a design specially prepared for a fashion collection,An eccentric or unusual person
ostentatious,Characterized by vulgar or pretentious display or designed to impress or attract notice
paranoid,"Of, characterized by, or suffering from the mental condition of paranoia","Unreasonably or obsessively anxious, suspicious, or mistrustful",A person who is paranoid
passionate,Showing or caused by strong feelings or a strong belief,Showing or caused by intense feelings of sexual love,Dominated by or easily affected by intense emotion
passive-aggressive,"Of or denoting a type of behavior or personality characterized by indirect resistance to the demands of others and an avoidance of direct confrontation, as in procrastinating, pouting, or misplacing important materials"
passive-dependent
pathological liar
patient,Able to wait without becoming annoyed or anxious,Slow to lose one's temper with irritating people or situations,A person receiving or registered to receive medical treatment,The semantic role of a noun phrase denoting something that is affected or acted upon by the action of a verb
pedantic,Of or like a pedant
perceptive,Having or showing sensitive insight
perfectionist,Refusing to accept any standard short of perfection,A person who refuses to accept any standard short of perfection
persecution complex,An irrational and obsessive feeling or fear that one is the object of collective hostility or ill
perseverance ,Steadfastness in doing something despite difficulty or delay in achieving success,Continuance in a state of grace leading finally to a state of glory
persistent,Continuing firmly or obstinately in a course of action in spite of difficulty or opposition,"Characterized by a specified habitual behavior pattern, esp. a dishonest or undesirable one",Continuing to exist or endure over a prolonged period,Occurring repeatedly over a prolonged period,(of a chemical or radioactivity) Remaining within the environment for a long time after its introduction,"(of a part of an animal or plant, such as a horn, leaf, etc.) Remaining attached instead of falling off in the normal manner"
persuasiveness
pessimistic,Tending to see the worst aspect of things or believe that the worst will happen
petty,Of little importance or trivial,"(of behavior) Characterized by an undue concern for trivial matters, esp. in a small","Of secondary or lesser importance, rank, or scale or minor",(of a crime) Of lesser importance
physical-minded
poised,Having a composed and self,Having a graceful and elegant bearing
pompous,"Affectedly and irritatingly grand, solemn, or self",Characterized by pomp or splendor
possessive,Demanding someone's total attention and love,Showing a desire to own things and an unwillingness to share what one already owns,Relating to or denoting the case of nouns and pronouns expressing possession,A possessive word or form,The possessive case
practical,Of or concerned with the actual doing or use of something rather than with theory and ideas,"(of an idea, plan, or method) Likely to succeed or be effective in real circumstances or feasible",Suitable for a particular purpose,(of a person) Sensible and realistic in their approach to a situation or problem,(of a person) Skilled at manual tasks,So nearly the case that it can be regarded as so or virtual
precise,Marked by exactness and accuracy of expression or detail,"(of a person) Exact, accurate, and careful about details",Used to emphasize that one is referring to an exact and particular thing
prejudiced,Having or showing a dislike or distrust that is derived from prejudice or bigoted
presumptuous ,(of a person or their behavior) Failing to observe the limits of what is permitted or appropriate
pretentious,"Attempting to impress by affecting greater importance, talent, culture, etc., than is actually possessed"
prideful
procrastinator
progressive,Happening or developing gradually or in stages or proceeding step by step,(of a disease or ailment) Increasing in severity or extent,(of taxation or a tax) Increasing as a proportion of the sum taxed as that sum increases,(of a card game or dance) Involving a series of sections for which participants successively change place or relative position,Engaging in or constituting forward motion,"(of a group, person, or idea) Favoring or implementing social reform or new, liberal ideas",Favoring or promoting change or innovation,"Relating to or denoting a style of rock music popular esp. in the 1980s and characterized by classical influences, the use of keyboard instruments, and lengthy compositions","Denoting an aspect or tense of a verb that expresses an action in progress, e.g., am writing, was writing","A person advocating or implementing social reform or new, liberal ideas",A progressive tense or aspect,"Each of a set of proofs of color work, showing all the colors separately and the cumulative effect of overprinting them"
promiscuous,"(of a person) Having many sexual relationships, esp. transient ones",(of sexual behavior or a society) Characterized by such relationships,Demonstrating or implying an undiscriminating or unselective approach or indiscriminate or casual,Consisting of a wide range of different things
pugnacious,"Eager or quick to argue, quarrel, or fight",Having the appearance of a willing fighter
realistic,Having or showing a sensible and practical idea of what can be achieved or expected,Representing familiar things in a way that is accurate or true to life
reasonable,(of a person) Having sound judgment or fair and sensible,Based on good sense,"(of a person or animal) Able to think, understand, or form judgments by a logical process",As much as is appropriate or fair or moderate,Fairly good or average,(of a price or product) Not too expensive
rebellious,"Showing a desire to resist authority, control, or convention","(of a person, city, or state) Engaged in opposition or armed resistance to an established government or ruler",(of a thing) Not easily handled or kept in place
reckless,(of a person or their actions) Without thinking or caring about the consequences of an action
recognition,"The action or process of recognizing or being recognized, in particular",Identification of a thing or person from previous encounters or knowledge,"Acknowledgment of something's existence, validity, or legality","Appreciation or acclaim for an achievement, service, or ability",Formal acknowledgment by a country that another political entity fulfills the conditions of statehood and is eligible to be dealt with as a member of the international community
refined,With impurities or unwanted elements having been removed by processing,"Elegant and cultured in appearance, manner, or taste",Precise or subtle
regressive,Becoming less advanced or returning to a former or less developed state,"Of, relating to, or marked by psychological regression",(of a tax) Taking a proportionally greater amount from those on lower incomes,Proceeding from effect to cause or from particular to universal
rejected,"Dismiss as inadequate, inappropriate, or not to one's taste",Refuse to agree to (a request),Fail to show due affection or concern for (someone) or rebuff,Show an immune response to (a transplanted organ or tissue) so that it fails to survive
relatedness
repressed,"Restrained, inhibited, or oppressed","(of a thought, feeling, or desire) Kept suppressed and unconscious in one's mind","Having or characterized by a large number of thoughts, feelings, or desires, esp. sexual ones, that are suppressed in this way"
resentful,Feeling or expressing bitterness or indignation at having been treated unfairly
reserved,Slow to reveal emotion or opinions,Kept specially for a particular purpose or person
resigned,Having accepted something unpleasant that one cannot do anything about
resilient,"(of a substance or object) Able to recoil or spring back into shape after bending, stretching, or being compressed",(of a person or animal) Able to withstand or recover quickly from difficult conditions
resolute,"Admirably purposeful, determined, and unwavering"
resourceful,Having the ability to find quick and clever ways to overcome difficulties
respectful,Feeling or showing deference and respect
responsible,"Having an obligation to do something, or having control over or care for someone, as part of one's job or role",Being the primary cause of something and so able to be blamed or credited for it,"(of a job or position) Involving important duties, independent decision",Having to report to (a superior or someone in authority) and be answerable to them for one's actions,Capable of being trusted,Morally accountable for one's behavior
responsive,Reacting quickly and positively,Responding readily and with interest or enthusiasm,Answering,(of a section of liturgy) Using responses
restless,(of a person or animal) Unable to rest or relax as a result of anxiety or boredom,Offering no physical or emotional rest or involving constant activity or motion
reticent,Not revealing one's thoughts or feelings readily
"ridicule, fear of"
rigid,Unable to bend or be forced out of shape or not flexible,"(of a person or part of the body) Stiff and unmoving, esp. as a result of shock or fear",Not able to be changed or adapted,"(of a person or their behavior) Not adaptable in outlook, belief, or response"
sadistic,"Deriving pleasure from inflicting pain, suffering, or humiliation on others"
secretive,(of a person or an organization) Inclined to conceal feelings and intentions or not to disclose information,(of a state or activity) Characterized by the concealment of intentions and information,(of a person's expression or manner) Having an enigmatic or conspiratorial quality
sedate,"Calm, dignified, and unhurried",Quiet and rather dull,Calm (someone) or make them sleep by administering a sedative drug
seducer
self-abasement
self-aware
self-castigation
self-confident
self-conscious,"Feeling undue awareness of oneself, one's appearance, or one's actions","Having knowledge of one's own existence, esp. the knowledge of oneself as a conscious being","(esp. of an action or intention) Deliberate and with full awareness, esp. affectedly so"
self-controlled
self-deceit
self-esteem,Confidence in one's own worth or abilities or self
self-pity,"Excessive, self"
self-protective
self-reliant,Reliant on one's own powers and resources rather than those of others
selfish,"(of a person, action, or motive) Lacking consideration for others or concerned chiefly with one's own personal profit or pleasure"
senile,"(of a person) Having or showing the weaknesses or diseases of old age, esp. a loss of mental faculties",(of a condition) Characteristic of or caused by old age,Approaching the end of a cycle of erosion,A senile person
sensitive,"Quick to detect or respond to slight changes, signals, or influences","Easily damaged, injured, or distressed by slight changes",(of photographic materials) Prepared so as to respond rapidly to the action of light,(of a market) Unstable and liable to quick changes of price because of outside influences,(of a person or a person's behavior) Having or displaying a quick and delicate appreciation of others' feelings,Easily offended or upset,Kept secret or with restrictions on disclosure to avoid endangering security,A person who is believed to respond to occult influences
sensual,"Of or arousing gratification of the senses and physical, esp. sexual, pleasure"
sensuous,Relating to or affecting the senses rather than the intellect,"Attractive or gratifying physically, esp. sexually"
sentimental,"Of or prompted by feelings of tenderness, sadness, or nostalgia","(of a work of literature, music, or art) Dealing with feelings of tenderness, sadness, or nostalgia in an exaggerated and self","(of a person) Excessively prone to feelings of tenderness, sadness, or nostalgia"
serious,(of a person) Solemn or thoughtful in character or manner,"(of a subject, state, or activity) Demanding careful consideration or application",(of thought or discussion) Careful or profound,"(of music, literature, or other art forms) Requiring deep reflection and inviting a considered response","Acting or speaking sincerely and in earnest, rather than in a joking or halfhearted manner",Significant or worrying because of possible danger or risk or not slight or negligible,"Substantial in terms of size, number, or quality"
shrewd,Having or showing sharp powers of judgment or astute,(esp. of weather) Piercingly cold,(of a blow) Severe,Mischievous or malicious
shy,Being reserved or having or showing nervousness or timidity in the company of other people,Slow or reluctant to do (something),Having a dislike of or aversion to a specified thing,(of a wild mammal or bird) Reluctant to remain in sight of humans,Less than or short of,Before,(of a plant) Not bearing flowers or fruit well or prolifically,Fling or throw (something) at a target,An act of flinging or throwing something at a target
sincere,Free from pretense or deceit or proceeding from genuine feelings,(of a person) Saying what they genuinely feel or believe or not dishonest or hypocritical
skeptical,Not easily convinced or having doubts or reservations,Relating to the theory that certain knowledge is impossible
social,Of or relating to society or its organization,Of or relating to rank and status in society,Needing companionship and therefore best suited to living in communities,Relating to or designed for activities in which people meet each other for pleasure,(of a bird) Gregarious or breeding or nesting in colonies,"(of an insect) Living together in organized communities, typically with different castes, as ants, bees, wasps, and termites do","(of a mammal) Living together in groups, typically in a hierarchical system with complex communication","An informal social gathering, esp. one organized by the members of a particular club or group"
spiritual,"Of, relating to, or affecting the human spirit or soul as opposed to material or physical things",(of a person) Not concerned with material values or pursuits,Of or relating to religion or religious belief,"A religious song of a kind associated with black Christians of the southern US, and thought to derive from the combination of European hymns and African musical elements by black slaves"
spontaneous,Performed or occurring as a result of a sudden inner impulse or inclination and without premeditation or external stimulus,"(of a person) Having an open, natural, and uninhibited manner",(of a process or event) Occurring without apparent external cause,(of a plant) Growing naturally and without being tended or cultivated,(of movement or activity in an organism) Instinctive or involuntary
stabile
stamina,The ability to sustain prolonged physical or mental effort
steadfast,Resolutely or dutifully firm and unwavering
stingy,Unwilling to give or spend or ungenerous,Insufficient in quantity or scanty
stubborn,"Having or showing dogged determination not to change one's attitude or position on something, esp. in spite of good arguments or reasons to do so","Difficult to move, remove, or cure"
submissive,Ready to conform to the authority or will of others or meekly obedient or passive
suicidal,Deeply unhappy or depressed and likely to commit suicide,Relating to or likely to lead to suicide,Likely to have a disastrously damaging effect on oneself or one's interests
superficial,Existing or occurring at or on the surface,Situated or occurring on the skin or immediately beneath it,Appearing to be true or real only until examined more closely,"Not thorough, deep, or complete or cursory",Not having or showing any depth of character or understanding
suppressed,Forcibly put an end to,"Prevent the development, action, or expression of (a feeling, impulse, idea, etc.) or restrain",Prevent the dissemination of (information),Prevent or inhibit (a process or reaction),Partly or wholly eliminate (electrical interference),Consciously inhibit (an unpleasant idea or memory) to avoid considering it
suspicious,Having or showing a cautious distrust of someone or something,"Causing one to have the idea or impression that something or someone is of questionable, dishonest, or dangerous character or condition",Having the belief or impression that someone is involved in an illegal or dishonest activity
sympathetic,"Feeling, showing, or expressing sympathy",Showing approval of or favor toward an idea or action,"Pleasant or agreeable, in particular",(of a person) Attracting the liking of others,(of a structure) Designed in a sensitive or fitting way,"Relating to or denoting the part of the autonomic nervous system consisting of nerves arising from ganglia near the middle part of the spinal cord, supplying the internal organs, blood vessels, and glands, and balancing the action of the parasympathetic nerves","Relating to, producing, or denoting an effect that arises in response to a similar action elsewhere"
taciturn,(of a person) Reserved or uncommunicative in speech or saying little
tactful,Having or showing tact
tactless,Having or showing a lack of adroitness and sensitivity in dealing with others or with difficult issues
talkative,Fond of or given to talking
temper,Improve the hardness and elasticity of (steel or other metal) by reheating and then cooling it,Improve the consistency or resiliency of (a substance) by heating it or adding particular substances to it,Serve as a neutralizing or counterbalancing force to (something),Tune (a piano or other instrument) so as to adjust the note intervals correctly,A person's state of mind seen in terms of their being angry or calm,A tendency to become angry easily,An angry state of mind,A character or mode of thought,The degree of hardness and elasticity in steel or other metal
temperament,"A person's or animal's nature, esp. as it permanently affects their behavior",The tendency to behave angrily or emotionally,"The adjustment of intervals in tuning a piano or other musical instrument so as to fit the scale for use in different keys or in equal temperament, the octave consists of twelve equal semitones"
