word,Meaning 1,Meaning 2,Meaning 3,Meaning 4
tenacious,Tending to keep a firm hold of something or clinging or adhering closely,"Not readily relinquishing a position, principle, or course of action or determined",Persisting in existence or not easily dispelled
tender,Showing gentleness and concern or sympathy,Solicitous of or concerned for,(of food) Easy to cut or chew or not tough,(of a plant) Easily injured by severe weather and therefore needing protection,(of a part of the body) Sensitive to pain,"Young, immature, and vulnerable",Requiring tact or careful handling,(of a ship) Leaning or readily inclined to roll in response to the wind,Offer or present (something) formally,Offer (money) as payment,"Make a formal written offer to carry out work, supply goods, or buy land, shares, or another asset for a stated fixed price",Make such an offer giving (a stated fixed price),A person who looks after someone else or a machine or place,A boat used to ferry people and supplies to and from a ship,A railcar coupled to a steam locomotive to carry fuel and water
tense,(esp. of a muscle or someone's body) Stretched tight or rigid,"(of a person) Unable to relax because of nervousness, anxiety, or stimulation","(of a situation, event, etc.) Causing or showing anxiety and nervousness","(of a speech sound, esp. a vowel) Pronounced with the vocal muscles stretched tight","Become tense, typically through anxiety or nervousness",Make (a muscle or one's body) tight or rigid,A set of forms taken by a verb to indicate the time (and sometimes also the continuance or completeness) of the action in relation to the time of the utterance
thorough,Complete with regard to every detail or not superficial or partial,Performed or written with great care and completeness,Taking pains to do something carefully and completely,"Absolute (used to emphasize the degree of something, typically something unwelcome or unpleasant)"
thoughtful,Absorbed in or involving thought,Showing consideration for the needs of other people,Showing careful consideration or attention
thoughtless,(of a person or their behavior) Not showing consideration for the needs of other people,Without consideration of the possible consequences
thrifty,(of a person or their behavior) Using money and other resources carefully and not wastefully,(of livestock or plants) Strong and healthy,Prosperous
timid,Showing a lack of courage or confidence or easily frightened
tolerant,Showing willingness to allow the existence of opinions or behavior that one does not necessarily agree with,"(of a plant, animal, or machine) Able to endure (specified conditions or treatment)"
trustful,"Having or marked by a total belief in the reliability, truth, ability, or strength of someone"
trustworthy,Able to be relied on as honest or truthful
truthful,(of a person or statement) Telling or expressing the truth or honest,(of artistic or literary representation) Characterized by accuracy or realism or true to life
tyrannical,Exercising power in a cruel or arbitrary way,Characteristic of tyranny or oppressive and controlling
unassuming,Not pretentious or arrogant or modest
uncommunicative,(of a person) Unwilling to talk or impart information,(of something such as writing or art) Not conveying much or any meaning or sense
unconcerned,"Showing a lack of worry or interest, esp. when this is surprising or callous"
uncooperative,Unwilling to help others or do what they ask
undisciplined,Lacking in discipline or uncontrolled in behavior or manner
unimpeachable,"Not able to be doubted, questioned, or criticized or entirely trustworthy"
uninhibited,Expressing one's feelings or thoughts unselfconsciously and without restraint
unpredictable,Not able to be predicted,(of a person) Behaving in a way that is not easily predicted
unreliable,Not able to be relied upon
unruly,Disorderly and disruptive and not amenable to discipline or control,(of hair) Difficult to keep neat and tidy
unstable,"Prone to change, fail, or give way or not stable",Prone to psychiatric problems or sudden changes of mood
unworldly,"(of a person) Not having much awareness of the realities of life, in particular, not motivated by material or practical considerations",Not seeming to belong to this planet or strange
unyielding,(of a mass or structure) Not giving way to pressure or hard or solid,(of a person or their behavior) Unlikely to be swayed or resolute
urges,Try earnestly or persistently to persuade (someone) to do something,Recommend or advocate (something) strongly,Encourage (a person or animal) to move more quickly or in a particular direction,Encourage someone to continue or succeed in something,A strong desire or impulse
usurious,Of or relating to the practice of usury
vacillating,Alternate or waver between different opinions or actions or be indecisive
vane,"A broad blade attached to a rotating axis or wheel that pushes or is pushed by wind or water and forms part of a machine or device such as a windmill, propeller, or turbine",The flat part on either side of the shaft of a feather,"A broad, flat projecting surface designed to guide the motion of a projectile, such as a feather on an arrow or a fin on a torpedo"
"variety, desire"
verbal facility
versatile,Able to adapt or be adapted to many different functions or activities,Changeable or inconstant
vindictive,Having or showing a strong or unreasoning desire for revenge
violent,"Using or involving physical force intended to hurt, damage, or kill someone or something",(esp. of an emotion or unpleasant or destructive natural force) Very strong or powerful,(of a color) Vivid,Involving an unlawful exercise or exhibition of force
virile,"(of a man) Having strength, energy, and a strong sex drive",Having or characterized by strength and energy
visionary,(esp. of a person) Thinking about or planning the future with imagination or wisdom,(of a scheme or idea) Not practical,"Of, relating to, or able to see visions in a dream or trance, or as a supernatural apparition",Existing only in a vision or in the imagination,A person with original ideas about what the future will or could be like
vital,Absolutely necessary or important or essential,Indispensable to the continuance of life,Full of energy or lively,Fatal,"The body's important internal organs, esp. the gut or the genitalia"
vitality,The state of being strong and active or energy,"The power giving continuance of life, present in all living things"
vivacious,(esp. of a woman) Attractively lively and animated
vixen,A female fox,A spiteful or quarrelsome woman
volcanic,"Of, relating to, or produced by a volcano or volcanoes",(esp. of a feeling or emotion) Bursting out or liable to burst out violently
vulgar,Lacking sophistication or good taste or unrefined,Making explicit and offensive reference to sex or bodily functions or coarse and rude,Characteristic of or belonging to the masses
wallflower,"A southern European plant of the cabbage family, with fragrant yellow, orange","A person who has no one to dance with or who feels shy, awkward, or excluded at a party"
wanton,(of a cruel or violent action) Deliberate and unprovoked,(esp. of a woman) Sexually immodest or promiscuous,Growing profusely or luxuriant,Lively or playful,Play or frolic,Behave in a sexually immodest or promiscuous way,A sexually immodest or promiscuous woman
warmhearted,(of a person or their actions) Sympathetic and kind
weak,Lacking the power to perform physically demanding tasks or lacking physical strength and energy,Lacking political or social power or influence,"(of a crew, team, or army) Containing too few members or members of insufficient quality",(of a faculty or part of the body) Not able to fulfill its functions properly,Of a low standard or performing or performed badly,Not convincing or logically forceful,Exerting only a small force,Liable to break or give way under pressure or easily damaged,"Lacking the force of character to hold to one's own decisions, beliefs, or principles or irresolute","(of a belief, emotion, or attitude) Not held or felt with such conviction or intensity as to prevent its being abandoned or dispelled",Not in a secure financial position,(of prices or a market) Having a downward tendency,Lacking intensity or brightness,(of a liquid or solution) Lacking flavor or effectiveness because of being heavily diluted,(of an acid) Only slightly ionized,Displaying or characterized by a lack of enthusiasm or energy,(of features) Not striking or strongly marked,(of a syllable) Unstressed,"Denoting a class of verbs in Germanic languages that form the past tense and past participle by addition of a suffix (in English, typically ","Of, relating to, or denoting the weakest of the known kinds of force between particles, which acts only at distances less than about 1015 cm, is very much weaker than the electromagnetic and the strong interactions, and conserves neither strangeness, parity, nor isospin"
welcoming,"Greet (someone arriving) in a glad, polite, or friendly way",Be glad to entertain (someone) or receive (something),React with pleasure or approval to (an event or development)
willful,(of an immoral or illegal act or omission) Intentional or deliberate,"Having or showing a stubborn and determined intention to do as one wants, regardless of the consequences or effects"
willing,"Ready, eager, or prepared to do something",Given or done readily
withdrawn,Not wanting to communicate with other people
xenophobic,Having or showing an intense or irrational dislike or fear of people from other countries
yes man
yielding,(of a substance or object) Giving way under pressure or not hard or rigid,(of a person) Complying with the requests or desires of others,Giving a product or generating a financial return of a specified amount
zany,Amusingly unconventional and idiosyncratic,An erratic or eccentric person,"A comic performer partnering a clown, whom he imitated in an amusing way"
zealous,Having or showing zeal
